{
  "specVersion": "0.3.0-live-strategy",
  "product": "Sentinel Alpha Skill",
  "mode": "simulation_only",
  "asset": "BNB/USDT",
  "scenario": "Live Market Analysis",
  "generatedAt": "2026-06-10T02:04:54.527Z",
  "marketContext": {
    "currentPrice": 591.72,
    "change24h": -1,
    "rsi": 71.4,
    "macdStatus": "Bullish crossover",
    "emaTrend": "Above EMA stack",
    "atrVolatility": "Normal",
    "fearGreed": {
      "score": 15,
      "label": "Extreme Fear"
    },
    "indicators": {
      "ema20": 586.9,
      "ema50": 579.73,
      "atr": 9.08,
      "macd": 2.4055,
      "macdSignal": 1.9012,
      "candleCount": 160,
      "candleSource": "okx_public_candles"
    }
  },
  "marketRegime": {
    "label": "Sideways",
    "explanation": "Signals are mixed, so the skill waits for cleaner confirmation before approving a new trade."
  },
  "decision": {
    "action": "WAIT",
    "confidenceScore": 55,
    "suggestedTimeframe": "4H"
  },
  "rules": {
    "entry": "Do not enter until trend, momentum, volatility, and sentiment guards align; re-evaluate on the next 4H candle close.",
    "exit": "Exit when price closes below the 20 EMA (586.90) or MACD flips bearish on the 4H chart.",
    "stopLoss": "No new stop is proposed because no new entry is approved.",
    "positionSizing": "Keep simulated allocation at 0% until trend, momentum, volatility, and sentiment conditions improve."
  },
  "riskGuard": {
    "status": "BLOCKED",
    "blockedReasons": [
      "Momentum quality: Momentum is stretched or turning against the setup.",
      "Sentiment risk: Fear & Greed is in an extreme zone."
    ],
    "checks": [
      {
        "label": "Trend confirmation",
        "status": "Pass",
        "detail": "BNB is trading above the EMA stack."
      },
      {
        "label": "Momentum quality",
        "status": "Fail",
        "detail": "Momentum is stretched or turning against the setup."
      },
      {
        "label": "Volatility control",
        "status": "Pass",
        "detail": "ATR is within an acceptable range for simulated stop sizing."
      },
      {
        "label": "Sentiment risk",
        "status": "Fail",
        "detail": "Fear & Greed is in an extreme zone."
      },
      {
        "label": "Backtest drawdown",
        "status": "Pass",
        "detail": "Recent simulated drawdown stays inside the risk cap."
      }
    ],
    "principle": "No trade is also a valid strategy."
  },
  "backtestSummary": {
    "simulatedReturn": 4.2,
    "maxDrawdown": 7.9,
    "winRate": 52,
    "numberOfTrades": 11,
    "buyHoldReturn": -2.3
  },
  "safetyConstraints": [
    "Simulation only.",
    "No wallet connection.",
    "No live trading.",
    "No transaction signing.",
    "No financial advice.",
    "Market and backtest outputs are for strategy testing only."
  ],
  "dataSource": {
    "type": "coinmarketcap_rest_plus_live_indicators_and_backtest",
    "marketData": "coinmarketcap_rest",
    "indicators": "live_candles",
    "backtest": "live_candles",
    "note": "BNB quote and Fear & Greed are loaded from CoinMarketCap REST API. RSI, MACD, EMA, ATR, and the backtest are calculated from live candles. If CMC OHLCV is unavailable, candle-based calculations transparently use the public BNBUSDT fallback."
  }
}
